{
  "schema": 1,
  "comment": "The commit message rules of kit (AGENTS.md): type(scope): Subject (#id), a blank line, and a body wrapped at 72 characters.",
  "types": ["feat", "fix", "docs", "style", "refactor", "test", "chore"],
  "subjectMax": 50,
  "bodyMax": 72,
  "changelog": { "path": "CHANGELOG.md", "translation": "CHANGELOG.ko.md" }
}
